{"attempt_leaf_fanout":[],"chunk_file_counts":{},"commit_scan_seconds":{},"generated_at_utc":"2026-07-31T20:46:54.933375+00:00","max_attempt_leaf_entries":0,"performance_metrics_digest":"41a9a673d2bca399c82cfa14c9b85b2edd42e71eac4699851e8fe4cd08531aa5","recovery_scan_seconds":0.017129176994785666,"run_digest":"dbfb65ebc094b5b5624ef040276fc114","run_file_count":4,"schema":"mosaic.performance_metrics","schema_version":1,"stage_file_counts":{}}
