{"attempt_leaf_fanout":[],"chunk_file_counts":{},"commit_scan_seconds":{},"generated_at_utc":"2026-07-31T20:45:24.500787+00:00","max_attempt_leaf_entries":0,"performance_metrics_digest":"ca7848d5f5582e9d9aa18d784bd646f9a327c99e456225aae09899d03c6624d4","recovery_scan_seconds":0.001873354020062834,"run_digest":"d1d8edcd29109e1712d9d06e2bf4ec5dbd89ce42133b9093e6439a45943eca6e","run_file_count":0,"schema":"mosaic.performance_metrics","schema_version":1,"stage_file_counts":{}}
