{"attempt_leaf_fanout":[],"chunk_file_counts":{},"commit_scan_seconds":{},"generated_at_utc":"2026-07-31T20:43:52.852998+00:00","max_attempt_leaf_entries":0,"performance_metrics_digest":"091c274108a813b507cc15ad573f8051a04bf2f92671773b847a6a6f7ebfe343","recovery_scan_seconds":0.017312979005509987,"run_digest":"0bcc03d285b0a56edd5bad3c1b4bd296","run_file_count":4,"schema":"mosaic.performance_metrics","schema_version":1,"stage_file_counts":{}}
