{"attempt_leaf_fanout":[],"chunk_file_counts":{},"commit_scan_seconds":{},"generated_at_utc":"2026-07-31T20:42:25.382711+00:00","max_attempt_leaf_entries":0,"performance_metrics_digest":"e59e39876c3a51499011930f802e846735e510949b71bde860113356d8fd2988","recovery_scan_seconds":0.004534890002105385,"run_digest":"2d6907dddc780ff650edf53083ed1f0ff71c645a0b460b8e27ccfd676ef61f0e","run_file_count":0,"schema":"mosaic.performance_metrics","schema_version":1,"stage_file_counts":{}}
