{"attempt_leaf_fanout":[],"chunk_file_counts":{},"commit_scan_seconds":{},"generated_at_utc":"2026-07-31T20:39:46.851793+00:00","max_attempt_leaf_entries":0,"performance_metrics_digest":"a56d6c493e3d82c4f21c269efd7fa5a77587853d0ff8d9a3e4d8fca28fdde374","recovery_scan_seconds":0.002133011003024876,"run_digest":"0d7c84a780eb79abc89bd6d2b9a4294be39ae45b0c4833b5b0166c200a77392a","run_file_count":0,"schema":"mosaic.performance_metrics","schema_version":1,"stage_file_counts":{}}
