{"attempt_leaf_fanout":[],"chunk_file_counts":{},"commit_scan_seconds":{},"generated_at_utc":"2026-07-31T20:37:11.650499+00:00","max_attempt_leaf_entries":0,"performance_metrics_digest":"260d6ef38153d17cd20158febb953706e949013ba337b17277c616b72a7416d5","recovery_scan_seconds":0.002073823008686304,"run_digest":"a959a6d4e5c01aeca9acac1aecac8cccd57c50cdff0866d1303418e16fefec4d","run_file_count":0,"schema":"mosaic.performance_metrics","schema_version":1,"stage_file_counts":{}}
