{"attempt_leaf_fanout":[],"chunk_file_counts":{},"commit_scan_seconds":{},"generated_at_utc":"2026-07-31T20:40:52.929248+00:00","max_attempt_leaf_entries":0,"performance_metrics_digest":"af86e7490f5c575d8858fb20c63616702b9dfcaaf1240599944a25e66e05ab11","recovery_scan_seconds":0.02147122099995613,"run_digest":"9d26d22f686f8f23f572f4e04cbed242","run_file_count":4,"schema":"mosaic.performance_metrics","schema_version":1,"stage_file_counts":{}}
