{"attempt_leaf_fanout":[],"chunk_file_counts":{},"commit_scan_seconds":{},"generated_at_utc":"2026-07-31T20:38:55.404210+00:00","max_attempt_leaf_entries":0,"performance_metrics_digest":"5c8b5be36f897247f76163ad08d0bf5dba55302e416bf7edea4dd82bd68df48f","recovery_scan_seconds":0.016714301018510014,"run_digest":"e19bfd6556fe6b98376d35ffb02b476d","run_file_count":4,"schema":"mosaic.performance_metrics","schema_version":1,"stage_file_counts":{}}
