{"attempt_leaf_fanout":[],"chunk_file_counts":{},"commit_scan_seconds":{},"generated_at_utc":"2026-07-31T20:35:11.026045+00:00","max_attempt_leaf_entries":0,"performance_metrics_digest":"a9711257ee3be7a84e5698fd4ced9589feeebd9581a6f26b17d2e3637c57aaf8","recovery_scan_seconds":0.017907516012201086,"run_digest":"f673ba4e0bb4e169e95f1363c5f46f3c","run_file_count":4,"schema":"mosaic.performance_metrics","schema_version":1,"stage_file_counts":{}}
