{"attempt_leaf_fanout":[],"chunk_file_counts":{},"commit_scan_seconds":{},"generated_at_utc":"2026-07-31T20:49:03.206620+00:00","max_attempt_leaf_entries":0,"performance_metrics_digest":"d0279836403fdf3154c571f26fcb9dad8e5f7b3eb7466bcc1cd98c39a7d07f26","recovery_scan_seconds":0.004509316000621766,"run_digest":"7279fde1be446dba4889dd554e083538c5a10b2f34fdd2e21275f969f67982ac","run_file_count":0,"schema":"mosaic.performance_metrics","schema_version":1,"stage_file_counts":{}}
